{
  "schema_version": "1.0",
  "id": "QD-20260309-AXS-VALUE-REACCEPTANCE-TREND-RESET-v1",
  "ts_iso": "2026-03-10T07:45:00Z",
  "thesis_id": "cycle_129_axs_value_reacceptance_trend_reset_v1",
  "name": "AXS Value Reacceptance Trend Reset v1",
  "version": "1.0",
  "asset": "AXS",
  "timeframe": "4h",
  "indicators": ["EMA_50","VWAP","ATR_14","RSI_14","MFI_14","ADX_14","PLUS_DI_14","MINUS_DI_14"],
  "entry_rules": {
    "long": [
      "low <= EMA_50 - 0.5 * ATR_14",
      "Close > EMA_50",
      "Close > VWAP",
      "RSI_14 crosses_above 49",
      "MFI_14 >= 50",
      "ADX_14 >= 15",
      "PLUS_DI_14 > MINUS_DI_14"
    ],
    "short": [
      "Disabled: thesis is bullish trend reset only"
    ]
  },
  "exit_rules": {
    "long": ["Stop loss: 1.1 * ATR_14 below entry","Take profit: 2.9 * ATR_14 above entry","Early exit if Close crosses_below VWAP","Time stop: 11 bars"],
    "short": ["Disabled: thesis is long-only"]
  },
  "position_sizing": {"risk_per_trade_pct": 0.0045},
  "regime_filter": {"allowed_regimes": ["transitional","trending"],"detection_method": "Value-reacceptance trend reset. AXS must regain slower structure and value with directional strength already improving, so the entry happens after regained structure rather than after a long ceremonial confirmation chain."},
  "variants": [{"name": "axs_value_reacceptance_trend_reset_v1","template_name": "value_reacceptance_trend_reset_long","parameters": [{"name": "ema_anchor", "value": 50},{"name": "reset_atr_mult", "value": 0.5},{"name": "rsi_reclaim", "value": 49},{"name": "mfi_floor", "value": 50},{"name": "adx_floor", "value": 15}],"risk_policy": {"stop_type": "atr","stop_atr_mult": 1.1,"tp_type": "atr","tp_atr_mult": 2.9,"risk_per_trade_pct": 0.0045,"max_concurrent_positions": 1,"max_holding_bars": 11},"execution_policy": {"entry_fill": "bar_close","tie_break": "worst_case","allow_reverse": false,"slippage_bps": 10,"fee_bps": 6},"risk_rules": ["direction=long_only","cooldown_bars=1"]}],
  "complexity_score": 2.0,
  "status": "ready_to_test",
  "source": "quandalf"
}
