{
  "schema_version": "1.0",
  "id": "QD-20260308-VVV-FUNDING-SNAPBACK-v6",
  "ts_iso": "2026-03-08T13:25:00Z",
  "thesis_id": "cycle_20260308_vvv_funding_snapback_trend_killswitch_relax_v6",
  "name": "VVV Funding Snapback Trend Kill-Switch Relax v6",
  "version": "6.0",
  "asset": "VVV",
  "timeframe": "1h",
  "indicators": [
    "FundingRate",
    "RSI_14",
    "ATR_14",
    "EMA_50",
    "ADX_14"
  ],
  "entry_rules": {
    "long": [
      "FundingRate <= -0.00018",
      "RSI_14 crosses_above 45",
      "ADX_14 <= 24"
    ],
    "short": [
      "FundingRate >= 0.00018",
      "RSI_14 crosses_below 55",
      "ADX_14 <= 24"
    ]
  },
  "exit_rules": {
    "long": [
      "Stop loss: 1.15 * ATR_14 below entry",
      "Take profit: 2.9 * ATR_14 above entry",
      "Early exit if Close < EMA_50",
      "Time stop: 20 bars"
    ],
    "short": [
      "Stop loss: 1.15 * ATR_14 above entry",
      "Take profit: 2.9 * ATR_14 below entry",
      "Early exit if Close > EMA_50",
      "Time stop: 20 bars"
    ]
  },
  "position_sizing": {
    "risk_per_trade_pct": 0.004
  },
  "regime_filter": {
    "allowed_regimes": [
      "ranging",
      "transitional"
    ],
    "detection_method": "Fallback continuity branch with ADX cap relaxed from 22 to 24 to recover density if v5 suppresses too many trades"
  },
  "variants": [
    {
      "name": "vvv_funding_snapback_trend_killswitch_relax_v6",
      "template_name": "funding_rsi_mean_reversion",
      "parameters": [
        { "name": "funding_extreme", "value": 0.00018 },
        { "name": "rsi_long_reclaim", "value": 45 },
        { "name": "rsi_short_reject", "value": 55 },
        { "name": "ema_filter", "value": 50 },
        { "name": "adx_max", "value": 24 }
      ],
      "risk_policy": {
        "stop_type": "atr",
        "stop_atr_mult": 1.15,
        "tp_type": "atr",
        "tp_atr_mult": 2.9,
        "risk_per_trade_pct": 0.004,
        "max_concurrent_positions": 1,
        "max_holding_bars": 20
      },
      "execution_policy": {
        "entry_fill": "bar_close",
        "tie_break": "worst_case",
        "allow_reverse": false,
        "slippage_bps": 12,
        "fee_bps": 7
      },
      "risk_rules": [
        "cooldown_bars=1",
        "skip_entry_if_atr_percentile_gt_95"
      ]
    }
  ],
  "complexity_score": 2.3,
  "status": "ready_to_test",
  "source": "quandalf"
}
