{
  "schema_version": "1.0",
  "id": "QD-20260309-BTC-VALUE-RECAPTURE-CONTINUATION-v1",
  "ts_iso": "2026-03-10T09:15:00Z",
  "thesis_id": "cycle_141_btc_value_recapture_continuation_v1",
  "name": "BTC Value Recapture Continuation v1",
  "version": "1.0",
  "asset": "BTC",
  "timeframe": "4h",
  "indicators": ["EMA_50","VWAP","ATR_14","RSI_14","MFI_14","ADX_14","PLUS_DI_14","MINUS_DI_14"],
  "entry_rules": {
    "long": [
      "low >= EMA_50 - 0.45 * ATR_14",
      "Close > EMA_50",
      "Close > VWAP",
      "RSI_14 crosses_above 49",
      "MFI_14 >= 50",
      "ADX_14 >= 14",
      "PLUS_DI_14 > MINUS_DI_14"
    ],
    "short": ["Disabled: thesis is bullish value-recapture continuation only"]
  },
  "exit_rules": {
    "long": ["Stop loss: 1.0 * ATR_14 below entry","Take profit: 2.9 * ATR_14 above entry","Early exit if Close crosses_below VWAP","Time stop: 11 bars"],
    "short": ["Disabled: thesis is long-only"]
  },
  "position_sizing": {"risk_per_trade_pct": 0.004},
  "regime_filter": {"allowed_regimes": ["trending","transitional"],"detection_method": "Value-recapture continuation after shallow downside trap. BTC must recover the medium anchor and value after only a shallow downside trap, with momentum already improving. This is the denser continuation branch rather than a full breakdown-reclaim event."},
  "variants": [{"name": "btc_value_recapture_continuation_v1","template_name": "value_recapture_continuation_long","parameters": [{"name": "ema_anchor", "value": 50},{"name": "trap_buffer_atr", "value": 0.45},{"name": "rsi_reclaim", "value": 49},{"name": "mfi_floor", "value": 50},{"name": "adx_floor", "value": 14}],"risk_policy": {"stop_type": "atr","stop_atr_mult": 1.0,"tp_type": "atr","tp_atr_mult": 2.9,"risk_per_trade_pct": 0.004,"max_concurrent_positions": 1,"max_holding_bars": 11},"execution_policy": {"entry_fill": "bar_close","tie_break": "worst_case","allow_reverse": false,"slippage_bps": 10,"fee_bps": 6},"risk_rules": ["direction=long_only","cooldown_bars=1"]}],
  "complexity_score": 1.9,
  "status": "ready_to_test",
  "source": "quandalf"
}
