{
  "schema_version": "1.0",
  "id": "QD-20260308-VVV-FUNDING-SNAPBACK-v1",
  "ts_iso": "2026-03-08T10:09:00Z",
  "thesis_id": "cycle_20260308_vvv_funding_snapback_v1",
  "name": "VVV Funding Snapback Mean-Reversion v1",
  "version": "1.0",
  "asset": "VVV",
  "timeframe": "1h",
  "indicators": [
    "FundingRate",
    "RSI_14",
    "ATR_14",
    "EMA_50"
  ],
  "entry_rules": {
    "long": [
      "FundingRate <= -0.00018",
      "RSI_14 crosses_above 45"
    ],
    "short": [
      "FundingRate >= 0.00018",
      "RSI_14 crosses_below 55"
    ]
  },
  "exit_rules": {
    "long": [
      "Stop loss: 1.15 * ATR_14 below entry",
      "Take profit: 2.9 * ATR_14 above entry",
      "Early exit if Close < EMA_50",
      "Time stop: 20 bars"
    ],
    "short": [
      "Stop loss: 1.15 * ATR_14 above entry",
      "Take profit: 2.9 * ATR_14 below entry",
      "Early exit if Close > EMA_50",
      "Time stop: 20 bars"
    ]
  },
  "position_sizing": {
    "risk_per_trade_pct": 0.004
  },
  "regime_filter": {
    "allowed_regimes": [
      "ranging",
      "transitional"
    ],
    "detection_method": "VVV shows elevated negative funding with strong liquidity; strategy fades crowding when RSI reclaims neutral momentum"
  },
  "variants": [
    {
      "name": "vvv_funding_snapback_balanced_v1",
      "template_name": "funding_rsi_mean_reversion",
      "parameters": [
        { "name": "funding_extreme", "value": 0.00018 },
        { "name": "rsi_long_reclaim", "value": 45 },
        { "name": "rsi_short_reject", "value": 55 },
        { "name": "ema_filter", "value": 50 }
      ],
      "risk_policy": {
        "stop_type": "atr",
        "stop_atr_mult": 1.15,
        "tp_type": "atr",
        "tp_atr_mult": 2.9,
        "risk_per_trade_pct": 0.004,
        "max_concurrent_positions": 1,
        "max_holding_bars": 20
      },
      "execution_policy": {
        "entry_fill": "bar_close",
        "tie_break": "worst_case",
        "allow_reverse": false,
        "slippage_bps": 12,
        "fee_bps": 7
      },
      "risk_rules": [
        "cooldown_bars=1",
        "skip_entry_if_atr_percentile_gt_95"
      ]
    }
  ],
  "complexity_score": 2.1,
  "status": "ready_to_test",
  "source": "quandalf"
}