{
  "schema_version": "1.0",
  "id": "QD-20260308-ETH-FUNDING-REVERSION-v1",
  "ts_iso": "2026-03-08T09:46:00Z",
  "thesis_id": "cycle_20260308_eth_funding_transfer_v1",
  "name": "ETH Funding Reversion Transfer v1",
  "version": "1.0",
  "asset": "ETH",
  "timeframe": "1h",
  "indicators": [
    "FundingRate",
    "RSI_14",
    "EMA_50",
    "ATR_14"
  ],
  "entry_rules": {
    "long": [
      "FundingRate <= -0.00005",
      "RSI_14 crosses_above 43",
      "Close > EMA_50"
    ],
    "short": [
      "FundingRate >= 0.00005",
      "RSI_14 crosses_below 57",
      "Close < EMA_50"
    ]
  },
  "exit_rules": {
    "long": [
      "Stop loss: 1.2 * ATR_14 below entry",
      "Take profit: 2.7 * ATR_14 above entry",
      "Early exit if FundingRate rises above -0.00003",
      "Time stop: 20 bars"
    ],
    "short": [
      "Stop loss: 1.2 * ATR_14 above entry",
      "Take profit: 2.7 * ATR_14 below entry",
      "Early exit if FundingRate drops below 0.00003",
      "Time stop: 20 bars"
    ]
  },
  "position_sizing": {
    "risk_per_trade_pct": 0.005
  },
  "regime_filter": {
    "allowed_regimes": [
      "transitional",
      "ranging"
    ],
    "detection_method": "asset-transfer test of SOL funding-reversion architecture onto deeper ETH liquidity"
  },
  "variants": [
    {
      "name": "eth_funding_reversion_asset_transfer",
      "template_name": "funding_rsi_mean_reversion",
      "parameters": [
        { "name": "funding_extreme", "value": 0.00005 },
        { "name": "rsi_long_reclaim", "value": 43 },
        { "name": "rsi_short_reject", "value": 57 },
        { "name": "ema_trend_filter", "value": 50 }
      ],
      "risk_policy": {
        "stop_type": "atr",
        "stop_atr_mult": 1.2,
        "tp_type": "atr",
        "tp_atr_mult": 2.7,
        "risk_per_trade_pct": 0.005,
        "max_concurrent_positions": 1,
        "max_holding_bars": 20
      },
      "execution_policy": {
        "entry_fill": "bar_close",
        "tie_break": "worst_case",
        "allow_reverse": false,
        "slippage_bps": 7,
        "fee_bps": 5
      },
      "risk_rules": [
        "cooldown_bars=1",
        "skip_entry_if_atr_percentile_gt_94"
      ]
    }
  ],
  "complexity_score": 2.5,
  "status": "ready_to_test",
  "source": "quandalf"
}
