{
  "schema_version": "1.0",
  "id": "QD-20260309-SOL-COMPRESSION-RELEASE-HIGHER-VALUE-ACCEPTANCE-v1",
  "ts_iso": "2026-03-09T12:38:00Z",
  "thesis_id": "cycle_153_sol_compression_release_higher_value_acceptance_v1",
  "name": "SOL Compression Release Higher-Value Acceptance v1",
  "version": "1.0",
  "asset": "SOL",
  "timeframe": "4h",
  "family_name": "sol_compression_release_higher_value_acceptance",
  "thesis": "SOL 4h compression-release continuation framed as retained higher-value acceptance after expansion. The key is not the breakout candle itself but whether price holds above higher value once volatility begins to expand, with only light compression evidence and simple post-release acceptance rules.",
  "primary_asset": "SOL",
  "primary_timeframe": "4h",
  "validation_targets": [
    {"asset": "SOL", "timeframe": "4h", "purpose": "walk_forward_screen"}
  ],
  "edge_mechanism": "light compression release followed by retained higher-value acceptance",
  "expected_regime": "transitional into trending expansion",
  "invalidation_condition": "If this lighter release-and-hold framework still cannot produce a tradeable sample, then compression-release continuation is not active enough on SOL 4h under current formulation.",
  "indicators": ["BBW_20_2.0","VWAP","EMA_55","ATR_14","PLUS_DI_14","MINUS_DI_14"],
  "entry_rules": {
    "long": [
      "BBW_20_2.0 <= 0.18",
      "Close > VWAP",
      "Close > EMA_55",
      "low >= VWAP - 0.40 * ATR_14",
      "PLUS_DI_14 >= MINUS_DI_14"
    ],
    "short": [
      "BBW_20_2.0 <= 0.18",
      "Close < VWAP",
      "Close < EMA_55",
      "high <= VWAP + 0.40 * ATR_14",
      "MINUS_DI_14 >= PLUS_DI_14"
    ]
  },
  "exit_rules": {
    "long": [
      "Stop loss: 1.1 * ATR_14 below entry",
      "Take profit: 2.9 * ATR_14 above entry",
      "Early exit if Close crosses_below VWAP",
      "Time stop: 9 bars"
    ],
    "short": [
      "Stop loss: 1.1 * ATR_14 above entry",
      "Take profit: 2.9 * ATR_14 below entry",
      "Early exit if Close crosses_above VWAP",
      "Time stop: 9 bars"
    ]
  },
  "position_sizing": {"risk_per_trade_pct": 0.004},
  "regime_filter": {
    "allowed_regimes": ["transitional","trending"],
    "detection_method": "Light compression evidence only, then retained higher-value acceptance through VWAP and EMA_55 with a wider ATR pullback allowance."
  },
  "variants": [{
    "name": "sol_compression_release_higher_value_acceptance_v1",
    "template_name": "compression_release_higher_value_acceptance",
    "parameters": [
      {"name": "bbw_max", "value": 0.18},
      {"name": "ema_anchor", "value": 55},
      {"name": "value_buffer_atr", "value": 0.40}
    ],
    "risk_policy": {
      "stop_type": "atr",
      "stop_atr_mult": 1.1,
      "tp_type": "atr",
      "tp_atr_mult": 2.9,
      "risk_per_trade_pct": 0.004,
      "max_concurrent_positions": 1,
      "max_holding_bars": 9
    },
    "execution_policy": {
      "entry_fill": "bar_close",
      "tie_break": "worst_case",
      "allow_reverse": true,
      "slippage_bps": 8,
      "fee_bps": 6
    },
    "risk_rules": ["cooldown_bars=0"]
  }],
  "complexity_score": 1.8,
  "status": "ready_to_test",
  "source": "quandalf"
}