{
  "schema_version": "1.0",
  "id": "QD-20260308-AXS-CHANNEL-SHORTBIAS-v5",
  "ts_iso": "2026-03-08T10:12:00Z",
  "thesis_id": "cycle_20260308_axs_channel_regime_restrict_v5",
  "name": "AXS EMA Channel Short-Bias Regime Restrict v5",
  "version": "5.0",
  "asset": "AXS",
  "timeframe": "1h",
  "indicators": [
    "EMA_20",
    "EMA_100",
    "RSI_14",
    "ATR_14"
  ],
  "entry_rules": {
    "long": [
      "Close > EMA_20",
      "RSI_14 crosses_above 51"
    ],
    "short": [
      "Close < EMA_20",
      "RSI_14 crosses_below 49"
    ]
  },
  "exit_rules": {
    "long": [
      "Stop loss: 1.1 * ATR_14 below entry",
      "Take profit: 3.3 * ATR_14 above entry",
      "Early exit if RSI_14 crosses_below 48",
      "Time stop: 18 bars"
    ],
    "short": [
      "Stop loss: 1.1 * ATR_14 above entry",
      "Take profit: 3.3 * ATR_14 below entry",
      "Early exit if RSI_14 crosses_above 52",
      "Time stop: 18 bars"
    ]
  },
  "position_sizing": {
    "risk_per_trade_pct": 0.0045
  },
  "regime_filter": {
    "allowed_regimes": [
      "transitional",
      "trending"
    ],
    "detection_method": "v4 showed PF>1 in trending/transitional and PF<1 in ranging; this refinement removes ranging exposure"
  },
  "variants": [
    {
      "name": "axs_channel_shortbias_regime_restrict_v5",
      "template_name": "ema_channel_switch",
      "parameters": [
        { "name": "ema_fast", "value": 20 },
        { "name": "ema_slow", "value": 100 },
        { "name": "rsi_long_trigger", "value": 51 },
        { "name": "rsi_short_trigger", "value": 49 }
      ],
      "risk_policy": {
        "stop_type": "atr",
        "stop_atr_mult": 1.1,
        "tp_type": "atr",
        "tp_atr_mult": 3.3,
        "risk_per_trade_pct": 0.0045,
        "max_concurrent_positions": 1,
        "max_holding_bars": 18
      },
      "execution_policy": {
        "entry_fill": "bar_close",
        "tie_break": "worst_case",
        "allow_reverse": false,
        "slippage_bps": 10,
        "fee_bps": 6
      },
      "risk_rules": [
        "cooldown_bars=1",
        "skip_entry_if_atr_percentile_gt_97"
      ]
    }
  ],
  "complexity_score": 2.0,
  "status": "ready_to_test",
  "source": "quandalf"
}
