{
  "schema_version": "1.0",
  "id": "QD-20260309-VVV-FUNDING-SNAPBACK-v8",
  "ts_iso": "2026-03-09T22:31:00Z",
  "thesis_id": "cycle_20260309_vvv_funding_snapback_faster_failure_exit_v8",
  "name": "VVV Funding Snapback Faster Failure Exit v8",
  "version": "8.0",
  "asset": "VVV",
  "timeframe": "1h",
  "indicators": [
    "FundingRate",
    "RSI_14",
    "ATR_14",
    "EMA_21",
    "ADX_14"
  ],
  "entry_rules": {
    "long": [
      "FundingRate <= -0.00018",
      "RSI_14 crosses_above 45",
      "ADX_14 <= 20"
    ],
    "short": [
      "FundingRate >= 0.00018",
      "RSI_14 crosses_below 55",
      "ADX_14 <= 20"
    ]
  },
  "exit_rules": {
    "long": [
      "Stop loss: 1.15 * ATR_14 below entry",
      "Take profit: 2.9 * ATR_14 above entry",
      "Early exit if Close < EMA_21",
      "Time stop: 20 bars"
    ],
    "short": [
      "Stop loss: 1.15 * ATR_14 above entry",
      "Take profit: 2.9 * ATR_14 below entry",
      "Early exit if Close > EMA_21",
      "Time stop: 20 bars"
    ]
  },
  "position_sizing": {
    "risk_per_trade_pct": 0.004
  },
  "regime_filter": {
    "allowed_regimes": [
      "ranging",
      "transitional"
    ],
    "detection_method": "v7 entry structure preserved; only the post-entry failure exit is accelerated from EMA_50 to EMA_21 to cut trending-regime bleed faster without altering the proven range-entry pocket"
  },
  "variants": [
    {
      "name": "vvv_funding_snapback_faster_failure_exit_v8",
      "template_name": "funding_rsi_mean_reversion",
      "parameters": [
        { "name": "funding_extreme", "value": 0.00018 },
        { "name": "rsi_long_reclaim", "value": 45 },
        { "name": "rsi_short_reject", "value": 55 },
        { "name": "ema_filter", "value": 21 },
        { "name": "adx_max", "value": 20 }
      ],
      "risk_policy": {
        "stop_type": "atr",
        "stop_atr_mult": 1.15,
        "tp_type": "atr",
        "tp_atr_mult": 2.9,
        "risk_per_trade_pct": 0.004,
        "max_concurrent_positions": 1,
        "max_holding_bars": 20
      },
      "execution_policy": {
        "entry_fill": "bar_close",
        "tie_break": "worst_case",
        "allow_reverse": false,
        "slippage_bps": 12,
        "fee_bps": 7
      },
      "risk_rules": [
        "cooldown_bars=1",
        "skip_entry_if_atr_percentile_gt_95"
      ]
    }
  ],
  "complexity_score": 2.3,
  "status": "ready_to_test",
  "source": "quandalf"
}
